0,"আমি বুঝতে পারছি না কেন আপনি আপনার গ্রাহকদের সঠিকভাবে আপনার অফারগুলি সম্পর্কে অবহিত না them.it সত্যিই একটি ব্র্যান্ড থেকে অপ্রত্যাশিত মত। পরিষ্কারভাবে বলতে পিজা জন্য অফার notice.but সত্য আরও পর্যন্ত শনিবার উপলব্ধ হবে different.when আমরা একটি দীর্ঘ ব্যস্ত ট্রাফিক পরে আপনার ধানমন্ডি শাখা পৌঁছানোর, আপনি বলতে খুব সহজেই অফার পূর্বে notice.this ছাড়া শেষ হয়েছে কিভাবে আপনি আপনার গ্রাহক পরিবেশন করা হয়? কি হয়েছে তোমার? গ্রাহক বা মুনাফা? নির্বাক গুরুত্বপূর্ণ জানি না। .. এইমাত্র আমি কিছু অন্যান্য পর্যালোচনায় দেখে আমি অভিজ্ঞ আপনার কাছে কিছু অন্য অতিথিদের সঙ্গে একই করেনি।"
0,"পরিবেশ চমৎকার, কিন্তু খাদ্য এবং দাম ভয়ানক। বার্গার শুধুমাত্র গরম রুটির মত মনে হয়।"
0,তাদের খাবারের স্বাদ ভাল না. তাছাড়া তুলনায় অতিরিক্ত দাম ধানমন্ডি শাখার ডেকোরেশন  কিছুই বিশেষ।
0,না চিহ্ন সেবার ... waiters মেনু থেকে নির্দিষ্ট আইটেম থাকার নাছোড়বান্দা ... না মানের খাদ্য ... এন অযৌক্তিক মূল্য পরিসীমা !!! হতাশাদায়ক ......
0,"খাদ্য ঠিক ছিল কিন্তু তারা আমাকে বিল যা আমি আদেশ করেননি এবং পাইনি আইটেম সহ ডাকাতি; আমি কোষাধ্যক্ষ এবং পরিশোধ আমি তাকে বলেছি যে আমি এই আদেশ করেন নি কিন্তু তিনি বলেছেন তার বিল করা হয়েছে এবং তিনি এই জন্য ""অনুভূতি দুঃখিত"" হয় আগে আগে চলত। আমি পরিচালকের সাথে একটি আর্গুমেন্ট ছিল এবং কিছু প্রশংসাসূচক আশা তিনিও প্রত্যাখ্যান করেন ছিল ""দুঃখিত বোধ"" এবং আমাকে ভাল সেবা দিয়ে পরের বার বিবেচনা করব যেন আমি একটা ভিক্ষুক am অর্থ বা কোনো কিছুর জন্য তাদের প্রার্থনা করা। আমি তাদের বলেছিলাম আর হবে পুরো টাকাটা চুরি যে ভুল এবং আমি লাইভ বিদেশে তাই এটা কোন ব্যাপার না, আপনি যা কিছু পরের বার করবেন না। খুব তাদের সঙ্গে হতাশ এবং ফিরে যখন আমি করছি BANGALDESH আসবে।"
0,ধানমন্ডি শাখা খাদ্য খারাপ মানের এবং গ্রাহক সেবা নিকৃষ্টতম খাদ্য মানের হয়েছে। আমি আগে এই ধরনের একটি ভয়ঙ্কর অভিজ্ঞতার মাধ্যমে হয়েছে না। এবং যে ভয়ঙ্কর অভিজ্ঞতা একটি খুব চড়া দামে যথাযোগ্য। আবার পরিদর্শন করবে না।
0,খাদ্য বেশি মূল্য নির্ধারণ করা হয় এবং স্বাদ চিহ্ন না আপ! আপনি চার্জ করতে যাচ্ছি যে অনেক অন্তত আপনি কি করতে পারেন আপনার রান্না উন্নত করতে হয়! পাস্তা সর্দি ছিল?!?! ???
0,"আমি বেইলি রোড শাখা গিয়েছিলাম। পিজা তাই খারাপ   আমি অনুভব এটা শুধু ডাকাতি ছিল। পনির খুব পাতলা এবং রুটি খুব পাতলা ছিল। টপিং এছাড়াও পরিমাণ খুব কম ছিল। এটা তোলে অনুভূত মত, আমার কিছু vaji সঙ্গে একটি রুটি হচ্ছে: P আচরণ ভাল যদিও কেন আমি 2 তারকা দিচ্ছি যে ছিল। কখনো যদি না খাদ্য মান উন্নত করে আবার চেষ্টা করতে যাচ্ছে।"
0,"আজ আমরা BBQ ধানমন্ডি শাখাতে সবচেয়ে ভয়াবহ অভিজ্ঞতা ছিল। তারা  ড্রিঙ্কস  উপর 50% ছাড় প্রস্তাব করা হয়েছে এবং আমি তাদের ফ্র্যাপে সব ফলে তাদের আজ রাতে গিয়ে যেমন গত রাত ছিল পছন্দ করেছে। এমনকি যদিও আমরা তাদের নম্বরে বলা হয় এবং ছিল যাচাই যে দোকান খোলা ছিল তারা আমাদের frappes সেবা করার বঞ্চিত! এমন নয় যে ony আমাদের menue প্রদানের পর ওয়েটার একটা সময় গ্রহণ ছিল ফিরে আসা। আমি দেখেছি যে ওয়েটার এবং পরিচালক Ano সঙ্গে একটি বিতর্ক ... থার ক্লায়েন্ট সমাধানে যায়নি। তাই অন্য ছোট ওয়েটার যারা টেবিল প্রতি হাটছিলাম তারপর অন্যান্য ওয়েটার তাকে থামাতে প্রণীত বলা হয়। তিনি আক্ষরিক থামিয়েছিল তাকে আমাদের প্রতি আসছে এবং তারপর তিনি অন্য 5mins নেন এই ওয়েটার dispute.then সমাধান করতে এবং পরিচালক অন্য চ্যাট ছিল, বছরে ফিসফিস আরো ভালো তারপর তারা উভয় বলতে তারা ফ্র্যাপে পরিবেশন করা যাবে না এসে !!! তারা বলল তারা সব উপাদানগুলো পরিমাণ স্বল্প! তারা আক্ষরিক  ড্রিঙ্কস  করতে যেমন বন্ধের সময় কাছের মানুষ ছিলেন না। তারা একটি প্রস্তাব চলছে এবং এটা হতে পারে না যে, তারা সব  ড্রিঙ্কস  প্রতিটি উপাদানের পরিমাণ স্বল্প !! যদিও আমরা বলেছিলেন আমরা অন্য কিছু এ সব চাইনি যে আন্তর্জাতিক চেইন তারা আমাদের সার্ভিস করা উচিত হচ্ছে তারা আমাদের সম্পূর্ণরূপে বঞ্চিত !! আমিও আমরা এই শুক্রবার রাতে ধানমন্ডি শাখায় গিয়ে পিজা খুব ভয়ানক ছিল উল্লেখ করা উচিত !!! এটা তোলে গুলশান শাখায় পিজা মত কিছুই ছিল না। সত্যিই সত্যিই এই অজ্ঞ মনোভাব দ্বারা হতাশ এবং আমি সন্দেহ আমি কখনো ফিরে যাব।"
0,কোমল  ড্রিঙ্কস  99 + ভ্যাট। :( এটা খুবই ব্যয়বহুল। অন্যরা
0,"ঠিক আছে, একজন সৎ পর্যালোচনা। গতকাল ধানমন্ডি শাখা কাছে গিয়ে খাদ্য ঠিক ছিল। এটা সম্পূর্ণ সাধারণ বাইরে কিছুই ছিল না এবং যে সম্পূর্ণরূপে ঠিক হয়েছে আইটেম প্রিমিয়াম মূল্য নির্ধারণ করা হয়নি যাবে। সেবা একেবারে ভয়ঙ্কর ছিল! আমি বলতে চাচ্ছি তুমি কেমন ওয়েটার বর্তমান অনেক সঙ্গে বলছি এখনও ব্যবসা আছে? একজন ওয়েটার আক্ষরিক বারবার বিনয় এর rudest এ ব্যাপারে জোর দিতে এবং সবচেয়ে অভিব্যক্তির বিরক্ত দ্বারা আমাদের উপর একটি আইটেম বাধ্য করার চেষ্টা করেছেন। আমরা CA ছিল ... ওয়েটার একাধিক বার দেব সামনে তাদের কোন সাড়া, প্রত্যেক সময়। না, তারা ব্যস্ত ছিল না, শুধু কাছের টিস্যু কাউন্টার (অথবা অন্যকিছু) দাঁড়িয়ে একেবারে কিছুই করছেন। এটা তোলে বিল পেতে 15 মিনিট সম্পর্কে তাদের নিয়ে যায় এবং অন্য 15 পরিবর্তন দেখাবে। সঙ্গীত খুব জোরে ছিল এবং তারা ভলিউম পরেও আমরা তাদের অনুরোধ নিচে চালু করা হয়নি। দয়া করে মনে রাখবেন এমনকি একবার আউট পুরো প্রক্রিয়ার মধ্য দিয়ে সার্ভার কোন অভদ্র হয়েছে নিতে। এখন, আসলে বিবেচনা করা যে ধানমন্ডি শাখা একটি অপেক্ষাকৃত নতুন নালী হয়, কোলাকুলি ব্যবহৃত এখনও অপেক্ষাকৃত ভালো অবস্থায় থাকা উচিত কিন্তু আইটেম তারা ছিল না। চামচ অধিকাংশই যে এটা প্রায় অনুভূতি দিয়েছে যে আমরা পুরোনো শাখা থেকে ব্যবহার করা পাত্রে সাথে উপলব্ধ করা হয়েছে তাদের উপর এত আঁচড়ের দাগ চিহ্ন ছিল। দর্প শ্রেণী JadurKathi.com বাংলাদেশের বিডি দাবি প্রতিফলিত করবেন না। নেই একটি ভাল সামগ্রিক অভিজ্ঞতা। নিশ্চিত হতে পারছি না আমি যদি না কোনো সময় শীঘ্রই অন্তত সেখানে ফিরে যেতে চাই। P.S.- প্রয়োজনে ছবি প্রদান করতে পারেন।"
0,"BBQ বাংলাদেশ ধানমন্ডি শাখা একটি বড় হতাশা, প্রতিটি আইটেমের মেনু কার্ডের মূল্য সত্যিই বিল মূল্য সঙ্গে পৃথক, আমি আপনার গুলশান শাখায় চেষ্টা করেছি প্রায় 6-7times জন্য এবং আমি এটি পছন্দ, কোন সেখান থেকে অভিযোগ .. আর 2times আপনার ধানমন্ডি শাখা .. আমার অভিজ্ঞতার খারাপ ছিল উভয় বার there.dhanmondi শাখা খাদ্য সম্পূর্ণ ভিন্ন মানের তোলে, এটা খুব খারাপ, আপনার পেন ক্রিম স্যুপ এর পরিমাণ খুবই কম ছিল .. মুরগির স্বাদ খারাপ এবং পরিবেশিত ঠান্ডা ছিল। ... দ্বিতীয় সময় আমি সেখানে গিয়েছিলাম, খাদ্য স্বাদ মাঝারি মানের  ছিল এবং আমি পরিষ্কারভাবে মনে রাখবেন যে আমি মেনু কার্ডে প্রায় 1500 -1600tk খোয়াতে খাদ্য আদেশ (কোরিয়ান Charboiled মুরগির 3pcs চিকেন, ভর্তা করা আলুর সাথে 1 টুকরা জ্যামাইকান মুরগির খাবার এবং 3 cocacolas)। তারা আমাকে 3000tk বিশ্বজুড়ে তাদের বিল ডাবল অভিযুক্ত। আমি আমার নিজের উপর গণনা করা হয়েছে এবং এটি প্রায় 1800tk-2000tk ভ্যাট এবং সার্ভিস চার্জ দিয়ে হত। এটা একটা স্পষ্ট জালিয়াতি ছিল .. এই ম্যানেজার, এবং ওয়েটার তাই কর্তৃপক্ষ consideration.I এই নিতে হবে কখনও BBQ বাংলাদেশ ফিরে যাচ্ছি মধ্যে একটি ভিতরে জালিয়াতি হতে পারে। এটি শুধুমাত্র আমাকে এই ধরনের একটি সমস্যা সম্মুখীন কিন্তু আমি আরো কয়েকটি মানুষ Bbq বাংলাদেশ ধানমন্ডি এর বিল সমস্যার সঙ্গে হতাশ জানি ছিল।"
0,প্লেটার ইফতারের খেয়ে ফেলতাম।  জ্যামাইকান মুরগির ফ্রাই ভাল ছিল। কিন্তু ফ্রাইড রাইস খুবই ভয়ানক ছিল। অলিভ অয়েল  গন্ধ সালাদ ছারখার।
0,"মানুষ বন্ধ চমত্কার মূলত। কল্যাণকামী ব্যবসার গম্ভীরভাবে মনেপ্রাণে যদি না নিতে দয়া করে। ব্যবস্থাপনা অত্যন্ত খারাপ   এবং তাদের আইটেমের বিবরণ তার কথায় সত্য নয়। ইফতার প্লেটার খুবই ভয়ানক ছিল। সুতরাং বার্গার হয়, মাংস কাঁচা ভিতরে ছিল যদিও ফ্রাই হওয়ার কথা এবং তাদের কোন চেডারপনির কোরিয়ান গৃহস্থালির কাজ সিদ্ধ বার্গার ভিতরে দেওয়া পনির ছিল।"
0,"খাবারটার স্বাদ এবং দাম একই রকম  নয় ... উপার্জন ঐ খাবার খরচ কি এতই সস্তা কিন্তু তারা মূল্য উচ্চ ভলিউম ব্যার্থতার করছে। দক্ষিণ koriean BBQ, শুধু শাখা Deco এবং BBQ লোগো সহ কিছুই smiler মূল ব্র্যান্ড হিসাবে মত একই। দুঃখিত কিন্তু মানের সঙ্গে সুখী ছিল না .."
0,আমরা অফারের খাবার 3 আদেশ ও খাদ্য মূলত স্বাদহীন ছিল! বাজি তারা লবণ ও অন্যান্য মশলা অনেকটা লাগাতে ভুলে গেছি। অতিরিক্ত মাত্রায় ব্যয়বহুল পরিমাণ তুলনায় এবং স্বাদ পাশাপাশি খারাপ ছিল। আর কখনও ফিরে যাচ্ছে!
0,আমি দুঃখিত কিন্তু এটা খারাপ খাদ্য অভিজ্ঞতা ছিল না। নিশ্চয় আমি সেখানে কি কখনো যেতে অভ্যস্ত। শান্তি বর্ষিত হোক।
0,একটি মুরগির পিজা কোনো ভূত্বক ছিল বা মালকড়ি .এটা শুধু একটি pancake.ভয়াবহ সার্ভিস.Not ফিরে আবার চলছিল আদেশ দেন। @Urmil রেহমান।
0,"আমি এই জায়গা ভালবাসা. কোরিয়ান charbroiled মুরগির জন্য মরতে হয়। আমি এখানে বার অনেক ছিলাম এবং আমি গত সময় পর্যন্ত হতাশ হয়েছে না। আমি ঠান্ডা খাদ্য পরিবেশিত হয়, এমনকি মাশরুম স্যুপ সবে উষ্ণ ছিল। আর কিছু আপনার আলু ভর্তা কি ভুল আছে, এটি সাধারণত (গুলশান শাখায়) যাতে মুখরোচক কিন্তু ধানমন্ডি শাখায় আমার গত দুই ভিজিট আমি এটা খুব হতাশ হয়েছিল (শেফ এখানে হতে পারে রেসিপি অধিকার পাচ্ছেন না) যাই হোক, আমি সত্যিই আশা করি আপনাকে বলছি শুধু একটি খারাপ দিন থাকার হয়েছে, কিন্তু দয়া করে নিশ্চিত করুন এই আবার ঘটবে না পারে তা নিশ্চিত ... ভয়ানক খাদ্য মাত্র গ্রহণযোগ্য নয়। আমি অপেক্ষায় থাকলাম আপনি অনেক আরো কয়েকবার দেখার জন্য, আমার জন্য জায়গা নষ্ট করবেন না দয়া করে। ধন্যবাদ"
0,খাদ্য আদৌ ভাল টেস্ট     করে নি। ইনসাইড Gangjeong চিকেন কোন মসলা ছিল না। ভেজিটেবল ফ্রাইড রাইসের স্বাদ এবং পরিমাণ পরিপ্রেক্ষিতে ব্যাবধানে গোল করেছি। এটি একটি খারাপ অভিজ্ঞতা ছিল যদিও সেবা ভাল ছিল এবং জায়গা চমৎকার। দাম খুব খুব বেশী স্বাদ বিবেচনা করা হয়।
0,আমি 0 থেকে শুরু দিতে পারেন ... কম্বো পিজা খারাপ ছিল>: _ <
0,ভয়ানক খাদ্য .... জায়গা ঘনবসতিপূর্ণ হয় .... মূল্য খুব বেশী ... শুধু টাকার অপচয়
0,45 মিনিট টুক একটি বাচ্চা খাবার পরিবেশন করা। তাদের সেবা এত খারাপ
0,"ঠিক আছে, আমি একটু আমার পর্যালোচনা দেরী কিন্তু কি জাহান্নাম হতে পারে। আমি প্রথম BBQ গিয়েছিলাম ডান পরে এটি খুলে আমার বন্ধু এবং আমি আমাদের পৃথক খাবারের আদেশ দেন। আমার বন্ধুদের আপনার পাস্তা এবং Didnt আদেশ এমনকি এটি একটি কামড় আছে তিনি খুব পূর্ণ ছিল, আমরা তা পুলিন্দা করার ওয়েটার বলেন কিন্তু তারা আমাদের বলেছেন তারা যে মুহূর্তে, তা করার সরঞ্জাম আছে হয়নি আমাদের বাকি আমরা স্টাফ খাদ্য সঙ্গে তাই পারিনি এমনকি পাস্তা খেয়ে অথবা এটি বাড়িতে নিয়ে। শেষে, আমরা পাস্তা এমনকি এটি একটি কামড় খাচ্ছি না তার জন্য টাকা দিতে হতো। এটা তোলে আমার দৃষ্টিকোণ একটি খুবই হতাশাজনক অভিজ্ঞতা ছিল।"
0,ভীড়ের সময়ও এসেছিল এবং 5 জনের জন্য আদেশ ও সেবা শ্রেষ্ঠ সময়ে ভয়ঙ্কর ছিল। পেয়েছেন বরফ ঠান্ডা খাবার পরিবেশিত এবং অন্তত 30 মিনিট জন্য এটি জন্য অপেক্ষা করছিল। আবর্জনা। এবং পরিচালকদের এটি সম্পর্কে অভিশাপ যত্ন ছিল। পাঠ শিখেছি এই স্থানে যান না যখন আপনি কার কামাই করতেসে বাহিরে পার্ক করা!
0,অন্যান্য রেস্তোরাঁয় তুলনা তারা খারাপ   সেবা সরবরাহে সহায়তা খাবার মান সম্পর্কে কথা বলতে না কারণ টাকা মোট নষ্ট ছিল দিন :) ধন্যবাদ তোমার দর্শন লগ করা
0,"সার্ভিস, ভয়ঙ্কর হয়, তাহলে আপনি খাদ্য মানের দাম এটা খুব চয়নের জন্য সবচেয়ে খারাপ অনুযায়ী বিবেচনা। আমার পরামর্শ হিসেবে এখানে আপনার সময় এবং অর্থ নষ্ট করতে আসে না।"
0,শুধুমাত্র ছবির জন্য না সব সময়ে খাদ্যের জন্য ভাল। তারা প্যাড থাই নুডলস বিক্রি কিন্তু তাদের মেনুতে এটা মিশ্র chawmin হিসেবে লেখা হয়। এটা তোলে গ্রহণযোগ্য নয়। resturent এর মোহাম্মদপুর সবচেয়ে যে কোনো ভ্যাট চার্জ করা হয়নি কিন্তু তারা ভ্যাট চার্জ। সার্ভিস আমিও ধীর। খাদ্য স্বাদ মূল্য অনুযায়ী চিহ্ন পর্যন্ত নেই। এ সব সুপারিশ করা হয় না। সেট মেনু স্বাদ এত খারাপ যে আমরা শেষ করতে পারে না।
