0,খাদ্য সবে ভক্ষণযোগ্য ছিল। মুরগির ফ্রাই কাঠ মত শক্ত ছিল। এবং অন্য খাদ্য ময়দা এবং কম চিংড়ি ও গরুর মাংস পূর্ণ ছিল।
0,বাংলাদেশ সবচেয়ে খারাপ চীনা রেঁস্তোরা। এমনকি তারা মরিচ গরুর মাংস বা সহজ ফ্রাইড রাইস রান্না করা কিভাবে জানি না !!! দূরে থাকুন ... সত্যি এই আবর্জনা উপর আপনার টাকা ব্যয় না !!!
0,খারাপ খাদ্য আমি কখনো দেখনি। এছাড়াও স্টাফদের  এর আচরণ ঘৃণা করেন। তারা শুধু আমার পরিবারের সামনে লজ্জা আমাকে দিলেন। প্রথম ও শেষবারের মতো। -_-
0,মাঝারি মানের  খাদ্য ও সত্যিই খারাপ সেবা। এটা আমার প্রথম ও শেষ সময় ছিল।
0,তাদের খাদ্য স্বাদ poor.সার্ভিস এছাড়াও শূন্য হয়।
0,"খারাপ কি কখনো অভিজ্ঞতা। অপেশাদারী মনোভাব, মূক স্টাফ, ব্যবস্থা বসা ঘনবসতিপূর্ণ, এবং সবচেয়ে গুরুত্বপূর্ণভাবে খারাপ কি কখনো খাদ্য। আমি আমার জীবনে কখনও খারাপ খাদ্য এই ধরনের করেননি। ওহ ঈশ্বর, আমি আপনাকে বলছি অনুরোধ আপনার মূল্যবান টাকা, ওইখানে সময় এবং মেজাজ নষ্ট করতে নয়।"
0,সেখানে মানুষ ... টাকা এবং সময় তার নষ্ট যেয়ো না .... তারা পরিশোধ পোস্ট করছেন #FOODBANK পর্যালোচনা এবং মানের খাবার সার্ভিস না দ্বারা অবৈধভাবে টাকা পেতে ...
0,"যদি তোমার দর্শন লগ করা মিষ্টি আছে এটা উর চিনি ভর্তি হবে কিন্তু তোমার দর্শন লগ করা ডায়াবেটিকসের আছে তারপর, এটা আপনার স্বাস্থ্যের জন্য ক্ষতিকারক। তাই সতর্কতা অবলম্বন করা."
0,Pathao দ্বারা আদেশ ও খুব খুব নিম্ন মানের খাদ্য পরিবেশিত এবং এক খাদ্য অনুপস্থিত ছিল।
0,"খারাপ অভিজ্ঞতা এক। আমরা খাদ্যের জন্য মত 1 ঘন্টা অপেক্ষা করছিল। যখন এটি আগত, খাদ্য গরম ছিল না! মানে কী মানুষ! এটা গরম হতে হবে। তারপর আমরা আবার পুরীতে জন্য অর্ডার ও আধা ঘন্টার জন্য অপেক্ষা করছিল। আমার কথা বিশ্বাস করুন যখন আমি বলি এই ""আমি ঐ সময় পুরাতন পেয়েছি, মানুষ! মানে সত্যিই পুরানো '-_- ডেকোরেশন ীণ খুব ভাল। ভাল বেশী। এটি একটি অনন্য ধারণা আমি অবশ্যই বলবো না। খাবার ভাল ছিল কিন্তু ঠান্ডা আমি অনুমান পেয়েছিলাম। স্বাদ ঠিক ছিল।"
0,খারাপ কাবাব আমি ছিল এবং আজ এক বিরল অনুষ্ঠানে অন্যতম রোযা আমি এমনকি আমার খাবার শেষ করতে পারিনি একটি সম্পূর্ণ দিনের পর। স্বাদ গম্ভীরভাবে বিশেষত মাছ chaap এর যে অনেক উন্নতি করতে আছে।
0,স্বাদ সঙ্গে একটি খারাপ অভিজ্ঞতা ছিল
0,আমি কোথা থেকে শুরু করব? সেবা করার জন্য দীর্ঘ গাধা সময় করে নিতেন। আসনবিন্যাস এলাকা তাই takeaway হয় ছিল একটি বিশাল ইঁদুর দেখেছি। খাদ্য হিসাবে ভাল ভয়াবহ ছিল। কখনও ফিরে যাচ্ছে ... সেই ইঁদুর আমাকে দুঃস্বপ্ন দিতে করত হয়
0,খারাপ স্বাদ
0,প্রধান খাদ্য আমি অপছন্দ। পদ্ধতি chaap। এটি এমনকি চিহ্ন পর্যন্ত নেই। তারা তাদের স্বাদ উন্নত করা উচিত নয়। সার্ভিস ও উপস্থাপনা ভাল ছিল।
0,"ভাঙ্গা চেয়ার টেবিল, সার্ভিস আপ fucked, ক্রম খাদ্য পরে দীর্ঘ সময় নিতে, খাদ্য ভয়ঙ্কর কোন স্বাদ"
1,পিজাটা চমৎকার ছিল । আমি এবং আমার বন্ধুদের এটি পছন্দ হয়েছে ।
1,এরাবিয়ান মাস্টারের  অভ্যন্তরীণ সজ্জাটা অনন্য। এটির খাদ্য সুস্বাদু এবং একটু মসলাযুক্ত .. তাদের কর্মীরা খুব বন্ধুত্বপূর্ণ।
1,কোরিয়ান এবং জামাইকান BBQ উপভোগ করার জন্য একটি চমৎকার জায়গা ।
1,BBQ এর মেনুগুলো সেরা।
1,শ্রেষ্ঠ স্বাদ ..... খাবারের মানও ভাল  ....
1,সেরা পরিবেশ সঙ্গে শ্রেষ্ঠ স্বাদ। একেবারে প্রিমিয়াম মুরগি।
1,সত্যিই খেতে দারুণ টেস্ট !!! আমি শুধু  BBQ ভালবাসি। খাবারটা অসাধারণ। আমি ওই জায়গায় যেতে ভালোবাসি। BBQ সব চেয়ে ভাল।
1,মহান খাদ্য বাহ ভাল বাহ সঙ্গে মহান সেবা .......................................... ..................................................
1,অসাধারণ এবং সুস্বাদু খাদ্য ... ভাল সার্ভিস এবং নিশ্চিত যে জায়গাটা সেরা! :) কোরিয়ান char boiled chicken ভালোবাসি।
1,গরম এবং মসলাযুক্ত চিকেন ফ্রাইটা পছন্দনীয়। চমৎকার পরিবেশ এবং আতিথেয়তা। আমি এটিকে  ঢাকায় শীর্ষস্থানীয় রেস্তোরাঁর মধ্যে রেটিং দিব ।
1,ব্রিলিয়ান্ট......।।
1,charboiled চিকেনটা অসাধারণ। অপূর্ব.........।!
1,"এটা সত্যিই একটি ভাল জায়গা। তুলনাহীন. তাদের আচরণও ভাল। সেরা আতিথেয়তা। খাদ্য ভাল। প্রতিটি খাদ্য সত্যিই  মজাদার এবং যুক্তিসংগত মূল্য। এই জায়গাটি দম্পতি, বন্ধু এবং পরিবারের জন্য ভাল। তাদের অভ্যন্তর নকশা খুব সুন্দর  ..... আমার সবকিছুই পছন্দ হয়েছে।"
1,"অপূর্ব খাবার, গ্রেট সার্ভিস... !!"
1,"এটা ডিনারের জন্য সত্যিই ভাল জায়গা, জ্যামাইকান এবং কোরিয়ান চিকেন উভয়ের টেস্টই ভাল ছিল ..... কম্বিনেশন পিজাটা ছিল দুর্দান্ত। আবার সেখানে যেতে পারলে ভালো লাগবে :)"
1,ভাল খাবার এবং চমৎকার সেবা...।
1,"BBQ বাংলাদেশকে এক কথায় বর্নণা করার সহজ শব্দ হচ্ছে "" অসাধারণ এবং নিখুত খাবারের ঐতিহ্য"""
1,ভালোবাসি!
1,সুস্বাদু। খাবারটা সত্যিই অনেক ভাল। তাদের  তৈরি mashed আলুটা অসাধারণ ছিল।
1,সুস্বাদু!
1,অপূর্ব খাবার!..............................
1,একেবারে ভালোবাসি!  খাবারটা  এত তাজা এবং সুস্বাদু ছিল! সম্ভবত এই মুহুর্তে ঢাকায় সেরা খাওয়ার একটি জায়গা।
1,অসাধারণ খাবার......!!!!!
1,এটি খুব ভাল জায়গা .. খাবার সত্যিই সুস্বাদু .. পরিবেশও যথেষ্ট ভাল .. আমরা এখানে থেকে লালবাঘ কেলার দৃশ্য দেখতে পারি .. সমস্ত কর্মীদের আচরণ ভাল এবং দামও যুক্তিসঙ্গত .
1,এই জায়গা একটি বোম্ব......।।জোস...।
1,চমত্কার
1,আজ রাতে BBQ তে আমার পরিবারের সাথে একটি অপূর্ব ডিনার ছিল এবং খাবারগুলো খুব সুস্বাদু ছিল।
1,শুধু 5 স্টার দেয়ার জন্য নিজেকে আর থামাতে পারছিনা।ভাল জায়গা । দারুণ খাবার :)
1,চিকেনটা জাস্ট ওয়াওওওও......।
1,"খাবারটা সুপার, জায়গাটা ও সেরা।"
1,খাবারটা অসাধারণ
1,শ্রেষ্ঠ খাবার!
1,আমার কাছে খাবারটা যথেষ্ট স্বাস্থ্যকর মনে হয়েছে। তাছাড়া পরিবেশ এবং লোকেশন দুইটাই আরামদায়ক ।
1,ফাটাফাটি......অসাধারণ......জোস...
1,আমার মতে সবচেয়ে আরামদায়ক জায়গা বিশেষ করে তাদের আচরণ খুবই বন্ধুত্বপূর্ণ
1,ইয়াম্মিইইইইইইইইইইই...
1,চমৎকার খাবার। ।
1,চমত্কার সেবা ...
1,"গ্রেট ফুড, ভাল সার্ভিস,জায়গাটা ও অনেক নীরব। সেরা রেস্টুরেন্টগুলার মধ্যে সহজেই রেঙ্কড করা যায়।"
1,অরিজিনাল BBQ চিকেন এবং Honey Mustard Salad খাওয়ার জন্য নিয়েছিলাম ... স্বাদটা চমৎকার ছিল এবং পরিবেশও খুব ভাল ছিল ... bbq সেরা ...
1,সেরা গ্রিল্ড চিকেন......:) :) :)
1,দুর্দান্ত খাবারের সঙ্গে অসাধারণ সার্ভিস......
1,সবচেয়ে ভাল জায়গা
1,বেশ ভাল .. চমত্কার ডেকোরেশন .. দামটা একটু বেশী.. কিন্তু খাবারটা সত্যিই ভাল ছিল .. তাজা এবং আমার জন্য স্পেশাল ছিল .. 
1,ভাল আচরণ এবং খাবার মজাদার ছিল
1,খুব ভাল খাদ্য। দাম অনুযায়ী ঠিক আছে.......
1,বাংলাদেশের সেরা খাবার।
1,এটা খুবই ভালো ...... আমি এটা ভালবাসি .......
1,চমৎকার পরিবেশ এবং ভাল ডেকোরেশন।
1,আমি সেখানে অনেক বার গিয়েছিলাম! এককথায় সেরা প্রাইচ এবং সেরা ফুড । 
1,ডেকোরেশনট যথেষ্ট ভাল ছিল। সার্ভিসও ভাল এবং ফাস্ট ছিল। এবং স্পেশাল জিনিস হচ্ছে তাদের খাবারের মান......খুবই সুস্বাদু এবং ইয়াম্মিইইইই। এখানে ফ্রি ওয়াইফাইও ছিল। চমৎকার আচরণ এবং সার্ভিস।  
1,"খাবারটা ইয়াম্মিইইইই ছিল,, সার্ভিসটাও খুব ভাল ..."
1,সেরা খাবার এবং স্বাদ। টাকাটা খরচ করা সম্পূর্ণ ঠিক আছে। প্লিজ চেক করবেন । রিকমেন্ডেড!
1,ইয়াম্মিইই খাবার ... চমৎকার আচরণ...
1,এটা অসাধারণ। শ্রেষ্ঠ কফি...
1,ভালো সময় কাটানোর জন্য যায়গাটি খুবই অসাধারণ। আমার পছন্দ হয়েছে। খুবই সুস্বাদু পিজা এবং পাস্তা। আমার অনেক ভাল লেগেছে। পিজ্জার দামও যুক্তিসঙ্গত
1,যাত্রাবাড়ীতে জন্মদিন পালনের জন্য সবচেয়ে ভাল জায়গা!
1,খুব ভাল...................
1,সার্ভিসটা খুব ভাল এবং খাবারের মানও খুব ভাল।
1,ফ্যামিলিকে সাথে ইফতার করতে গিয়েছিলাম। ইফতারের মেনু ভাল ছিল। আমিমনে করি পরিবার এবং বন্ধুদের সাথে hangout করার জন্য এটি একটি সুন্দর জায়গা । খাবারের মানও ভাল ছিল। খুব পরিষ্কার এবং পরিষ্কার ক্যাফে।
1,"এটি খুব ভাল একটি রেস্টুরেন্ট। ডেকোরেশনটা বিস্ময়কর আউটডোরটা আরও বিস্ময়কর ছিল। যুক্তিসংগত দাম সাথে খাবারটা এবং সার্ভিসটা চমৎকার মানের। আমি শুধু এই জায়গাটি ভালোবাসি ...... আরো অনেকবার যেতে চাই .....
"
1,5 স্টার খুবই ভাল রেস্তোরাঁ .. পরিবেশটা চমৎকার .. অপুর্ব খাবার এবং পুরোপুরি ওয়েটার দ্বারা পরিবেশিত .. আমি শুধু এই রেস্টুরেন্ট ভালবাসি ...
1,আমি তাদের আচরণ এবং সার্ভিস নিয়ে খুবই সন্তুষ্ট! খাবারের মান খুব ভাল ছিল! আমি এটা নিয়ে খুশি! নিশ্চয়ই এই জায়গাটায় আবার আসব! সর্বোপরি আচরণ অনেক ভাল ছিল!
1,আমি সাধারণত পোস্ট এবং মন্তব্য করি না তবে এই জায়গাটি অসাধারণ ছিল এবং খাবারটিও সুস্বাদু ছিল ...স্টাফগুলোও জোস ছিল এত বন্ধুত্বপূর্ণ এবং সার্ভিসটা অনেক ভাল ছিল ... ... ধন্যবাদ বলছি ..
1,আমার খাওয়া সেরা সেট মেনু এবং থাই স্যুপটি সুস্বাদু এবং মসলাযুক্ত ছিল। জোস এবং তাদের সার্ভিস এবং আচরণ ছিল অসাধারণ। আমার সত্যিই এই জায়গাটি এবং তাদের খাবার পছন্দ হয়েছে।
1,চমৎকার পরিবেশ এবং খাবারের মান জোস। হাইলি রিকমেন্ডড.
1,খাবার ছিল দারুণ  আর বার্গারটা ছিল অসাধারণ। এরাবিয়ান মাস্টার পুরো শহরে সমস্ত দোকানের মাস্টার হবে। ইনশাআল্লাহ
1,"তাদের কাছে চমৎকার জায়গা রয়েছে, এমনকি তাদের খাবারও সুস্বাদু , এমনকি তারা খাবারের মান ভালমত বজায় রাখে।"
1,খাবার খুবই ভাল শুধু তাই নয় জায়গাটিও চমৎকার ভিউটা অসাধারন। আমার ভিউটা খুব ভাল লেগেছে।
1,"যুক্তিসংগত দামের সাথে চমৎকার মানের খাবার ও সেবা ! তাছাড়া, পরিবেশ এত সুন্দর ... তাই, আমার মনে হয় তারা গ্রাহকদের পুরোপুরি সার্ভিস দিচ্ছে। মসলাটা ছিল অসাধারণ ।"
1,চমৎকার পরিবেশ এবং টেস্টি খাবার ... আমি প্রায় 25 জন লোকের একটি পার্টি দিয়েছিলাম তারা সকলেই খাবারগুলো পছন্দ করেছে .. স্টাফদের ব্যবহারও ভাল ছিল ... ইনশা আল্লাহ আবার ফিরে আসব এখানে।
1,সত্যিই ..... এটি  প্রশংসনীয় সুন্দর জায়গা। আমি এই রেষ্টুরেন্টের প্রেমে পড়ে গিয়েছি। তাদের খাবার খুবই সুস্বাদু এবং তাদের কর্মীরাও খুব ভাল। তারা অনেক অনুগত এবং খুব ভাল।
1,"রেস্টুরেন্টটা খুব ভাল এবং ডেকোরেশনটা অসাধারণ। তাদের খাবার খুব ভাল, মূল্যও যুক্তিসঙ্গত এবং কোয়ালিটিও খুব ভাল। আপনার ব্যবসার জন্য শুভেচ্ছা :)"
1,শুধু Woww ... ওসসসাম খাবারে কোয়ালিটি শুধু ভালবাসি এবং খুব সুন্দর জায়গা।
1,স্পাইসি-৬ এ এটি একটি চমৎকার অভিজ্ঞতা  ..... খাবারের কোয়ালিটি এবং সেবা দুইটাই চমৎকার । আমি এই জায়গাটি ভালোবাসি......
1,"যেহেতু আমি খাবার এবং নতুন পরিবেশ খুজতে ভালোবাসি, আমি কেবল তাদের পরিবেশ এবং অবশ্যই খাবার অনেক পছন্দ করেছি! সন্তোষজনক!"
1,আমি সেখানে বার বার যেতে যাই ..... সেখানে যাওয়াটা আমার জন্য একটি চমৎকার অভিজ্ঞতা ছিল। আমি স্ট্রবেরি শেক ভালবাসা এবং এটাকেই অগ্রাধিকার দিব।
1,প্রায়ই এখানে আসা হয় নিয়মিত গ্রাহকের মত। খাবারের মান এবং পরিবেশ দুইটাই ভাল। তাদের পিজা এবং সেট মেনুর দুইটাই জোস ..
1,খুব সুন্দর।
1,"অপুর্ব খাবার, সেরা সেবা এবং চমৎকার ডেকোরেশন। সামগ্রিকভাবে উপভোগ করার জন্য একটি চমৎকার জায়গা।"
1,তারা এই জায়গাটি অনেক সুন্দরভাবে সজ্জিত করেছে এবং খাদ্যের মানও খুব প্রশংসনীয়।
1,"স্থান, খাবার, ইন্টেরিওর এবং সেবা খুব ভাল। স্পাইসি-6 এওর জন্য শুভকামনা. আল্লাহ আপনাদের আশীর্বাদ করুক।"
1,এই জায়গাটা অসাধারণ। আমি শুধু এটা পছন্দ করি। ডেকোরেশনটা খুব ভাল।
1,অপুর্ব ইন্টেরিওর। খাবারটা ভালো। কিছু ভাল সময় কাটানোর জন্য সুন্দর জায়গা ।
1,যদি আমি আমার অনুভুতি এবং অভিজ্ঞতা নিয়ে বলি তবে 1 শব্দে স্পাইসি-৬ সেরা......।
1,খাবারের মান খুবই স্বাস্থ্যকর এবং ভাল .... আমি এটা পছন্দ করি ...
1,"ইন্টেরিওর এবং আচরণ সবই চমৎকার ছিল, ভাল খাবার, যুক্তিসংগত মূল্য।"
1,"পরিবেশ, খাবার ও সার্ভিস সবকিছুই সেরা ছিল .. !!"
1,লালবাগের অন্য কোন রেস্টুরেন্টের তুলনায় পরিবেশ ভালো এবং সেবাও ভাল
1,জোস একটা জায়গা। সুন্দর ডেকোরেশন এবং সুস্বাদু খাবার ..
1,"ভাল সময়, ভাল খাদ্য ,অসাধারণ জায়গা  এবং সুন্দর ডেকোরেশন........."
1,আমি জানিনা আমি আগে এখানে কেন আসিনাই। সত্যিই  অসাধারণ এবং নিখুঁত কফি।
1,নম্র আচরণ এবং খাবার এত স্বাস্থ্যকর এবং সুস্বাদু ছিল...
1,আমি এটা ভালবাসি
1,খুব ভালো খাবার.........
1,কোল্ড কফিটা খুবই ভাল ছিল...আপনারা ট্রাই করতে পারেন...।
1,পুরনো ঢাকায়  আমার দেখা DOSA Lazawab হল সর্বোত্তম ও অনন্য খাবারের কন্সেপ্ট। আমি তাদের সব খাবার পছন্দ করেছি।
1,চমৎকার জায়গা .. ভাল খাবার ..
1,এখানে সব চমৎকার স্বাদের  খাবার ..... ডোসা এর স্বাদ সেরা !!
1,চমৎকার এবং বন্ধুত্বপূর্ণ পরিবেশ .. ভাল খাবার .. আমার মতে সেট মেনুটা সেরা। এটা বজায় রাখেন.
