0,খাদ্যের মান সম্পূর্ণ অর্থহীন। দাম হাস্যকররকমের আকাশচুম্বী ছিল। সেখানে যেতে হবে না। বুদ্ধি বারি এবং পিজার রাজা এরচেয়ে অনেক ভাল
0,আমার খাওয়া সবচেয়ে খারাপ চিকেন ! সাজসজ্জাটা দেখার মত এবং তাই মানুষজন সেখানে যেতে মনস্থ .. কিন্তু খাবারের স্বাদ তেমন ভাল নয়! এবং খাবারের মান অনুযায়ী দাম অনেক বেশি!
0,আমি সবচেয়ে খারাপ সেবা পেয়েছিলাম !! খাবারের জন্য 1 ঘন্টা অপেক্ষা করতে হয়েছিল !!!
0,সবচেয়ে খারাপ সেবা । আমার খাওয়া সবচেয়ে খারাপ পিজা ছিল এবং তাদের মূল্যটাও অনেক বেশি বেশী।
0,অত্যধিক ব্যয়বহুল মুরগি কোন স্বাদ ছাড়াই। এরচেয়ে অনেক সস্তা কেএফসি বা স্থানীয় চিকেন এ যাওয়া ভাল।
0,খাবার খুব খারাপ ছিল। তাছাড়া খাবারের মান এবং পরিমাণ খুব কম ছিল।
0,তাদের  কোনো খাবারই কোন পছন্দ হয়নি। মেনু পুরো পৃষ্ঠায় ছিল কিন্তু খাবারের মান খুবই কম। মনে হয় না আবার ফিরে যাব।
0,আমার জীবনের সবচেয়ে খারাপ খাবার ... নিজের ঝুঁকিতে খেয়ে নিয়েন ..
0,সবচেয়ে খারাপ অভিজ্ঞতা !!! আমি প্রত্যেকের কাছে  অনুরোধ করবো এমন জায়গায় গিয়ে  অর্থ অপচয় না করার জন্য ।
0,আমার জীবনের খাওয়া সবচেয়ে খারাপ খাবার। পুরো টাকাটাই গোল্লায় গেল।
0,"আমি একটি পরিবারিক ডিনারের জন্য সেখানে গিয়েছিলাম। বিবিকু চিকেন এবং নানের সাথে সেট মেনুটি ছিল এবং আমি আপনাকে বলি যে আমি কখনই আমার কোর থেকে বিরক্ত ছিলাম না কারণ আমি কখনোই বারবিকিউ মুরগী ​​বা যেকোন খাবার এত খারাপ অন্য কোন রেস্টুরেন্টে  পাইনি। মুরগিটা ছিল জঘন্য, সিদ্ধ করা রাবারের উঁচু টুকরোর মত ছিল এবং খুবই খারাপ গন্ধ ছিল। আমি জানি না কোনও খারাপ দিন বা কিছু ছিল কিনা, তবে সবচেয়ে বেদনাদায়ক জিনিসটি হলো একটি প্লেট 'সরবরাহ করার জন্য তাদের 1:30 ঘন্টা সময় লেগেছিল। আমার পিতামাতার অন্যান্য সেট মেনু আইটেমগুলিতেও  BBQ অন্তর্ভুক্ত ছিল এবং মুরগিটা সেখানেও আমারটার মত খারাপ ছিল। যদিও কর্মীদের আচরণ ভাল ছিল  তারপরও এটি খারাপ খাদ্য এবং দীর্ঘ অপেক্ষা করার জন্য তৈরি করা হয় না। আমার অভিজ্ঞতা কি দুর্ঘটনা ছিল কিনা তা আমি জানি না তবে এটি নিশ্চিত ভয়ঙ্কর ছিল।"
0,বাজে খাবার এবং সবচেয়ে খারাপ সার্ভিস।
0,"গ্রিলটা ঠান্ডা ছিল, রুটিও শুকনো এবং শক্ত ছিল, স্টকটা পুরাতন ছিল ... খুবই খারাপ মানের খাবার ... হতাশ ..."
0,স্বাদ ও মূল্য অনুযায়ী কোনো রেস্টুরেন্টে খাওয়া সবচেয়ে খারাপ খাবার ।
0,"ঈদ ঊল আযহার দুই দিন পর সেখানে গিয়েছিলাম। খাবারটা খুব একটা ভাল ছিলনা। বিশেষ করে চালটা ভয়ানক ছিল। তাদের সার্ভিস ও খুবি জঘণ্য ছিল। সর্বোপরি, খুবই বাজে খাবার  এবং সার্ভিস।"
0,পিজার  স্বাদটা খুবই জঘণ্য ছিল।
0,"খাবারটি সবচেয়ে খারাপ ছিল। যদিও  সার্ভিসটা বেশ ভাল ছিল। আমরা জ্যামাইকান গ্রিলের সাথে ভাত অর্ডার করেছিলাম । চালটা  ছিল নষ্ট, গ্রিলটা খুব ভাল ছিল না।"
0,"স্বাদটা  একদম জঘন্য। দাম: খুব বেশি ব্যয়বহুল। এটি একটি ওভাররেটেড রেস্টুরেন্ট!
"
0,আজ আমার অভিজ্ঞতায় সবচেয়ে খারাপ সেবার মুখোমুখি হলাম। তারা আমাকে ঠান্ডা খাবার পরিবেশন করে এবং এমনকি অভিযোগের পরেও তারা বার বার পরিবর্তন করে একই ঠান্ডা খাবার পরিবেশন করে। গুলশান ২ টি আউটলেটের জন্য পুরোপুরি মাতাল! :(
0,ইফতার প্লেটারটা খুব খারাপ ছিল। পুরো খাদ্য ঠান্ডা সার্ভ করা হয়। চালটা জাহান্নামের মত কঠিন ছিল। এই ইফতার প্লেটের সঙ্গে খুবই হতাশ।
0,ইফতার প্লেটার জঘন্য । গতকাল গুলশান শাখায় এটি চেষ্টা করেছিলাম। অনর্থক এবং আমরা সব খাবার ভেস্তে গেল।
0,সবচেয়ে খারাপ সেবা !! তারা খুবই অশোভন এবং ইফতারের সময় ঠিকমত খাবার দেয়নি।
0,"এখানে আমরা রমজানের খাবারের জন্য  গিয়েছিলাম এক (জামাইকান ভাজা মুরগীর মাংস)  ... খাবারটি ছিল সম্পূর্ণ ঠান্ডা এবং জামাইকান ভাজা মুরগী, চিকেনটা শক্ত ছিল !!! এটা সুস্বাদু ছিল না এবং সব সময়ে খাবার ভর্তি, বরং এটি খাওয়ার অযোগ্য ছিল !!! আমি বেশ কয়েকবার গিয়েছিলাম, কিন্তু আগে এই ধরনের অভিজ্ঞতা ছিল না। যদি আমি জানতাম যে আমাকে এই শিট খেতে হবে, আমি রেগুলার মেনুই অর্ডার করতাম। এটা একেবারে প্রতারণা ।"
0,আমি আমার বাচ্চার জন্য বাচ্চাদের খাবারের অর্ডার দিলাম ... এবং সেই মুরগিটা থেকে  পচাঁ ডিমের মতো গন্ধ ছিল ... ইয়াক !! ... এবং এটা আমার সাথে দ্বিতীয় বার ঘটল ... তারা এত বেআইনী ... খুবই অপ্রত্যাশিত .. ।
0,খাবারের মান একেবারে জঘণ্য। আর যেই দাম .. পুরো খাবার অর্ডার করার জন্য ব্যাংক থেকে ঋণ প্রয়োজন।
0,সবচেয়ে খারাপ সেবা। ওয়েটাররা ব্যবহার খুবই বাজে ।  আর ফিরে আসব না।
0,"চমৎকার পরিবেশ , খাবার এবং ভয়ানক দাম। বার্গারটি গরম রুটির মত মনে হয়েছিল।"
0,"খাবারটা ঠিক ছিল কিন্তু তারা আমাকে এককথায় লুট করেছে, আমি যেসব খাবার অর্ডার করেনি তার বিল ও আমাকে ধরিয়ে দেয়া হয়েছে। খুবই হতাশ।"
0,ধানমন্ডি শাখায় খাবারের গুণগত মান সবচেয়ে খারাপ এবং সার্ভিসের ক্ষেত্রেও সবচেয়ে খারাপ।  এমন ভয়ঙ্কর অভিজ্ঞতার মধ্য দিয়ে আমি আর কখনো যাইনি  এবং খাবারের দামের ক্ষেত্রেও ভয়ঙ্কর অভিজ্ঞতা। আর আসবনা এখানে।
0,পিজ্জাটা খুব ভয়ানক ছিল !!! এটা গুলশান শাখার তুলনায় কিছুই ছিল না। সত্যিই তাদের এই সস্তা মনোভাব দ্বারা হতাশ এবং আমি কখনও আর ফিরে যাব কিনা সন্দেহ আছে ।
0,"BBQ বাংলাদেশ ধানমন্ডি শাখাটি  একটি বড় হতাশা, প্রতিটি আইটেমের দাম মেনু কার্ডের দেয়া মূল্য থেকে আলাদা।  আমি আপনাদের গুলশান শাখার প্রায় 6-7 বার এসেছি এবং আমি এটা পছন্দও করি , তাদের নিয়ে আমার কোনো অভিযোগও নেই । আমি আপনাদের  ধনমন্ডি  শাখায় ২ বার গিয়েছি এবং আমার অভিজ্ঞতা দুবারই খারাপ ছিল। ধানমন্ডি শাখার খাদ্যের  মান এবং সেবা সম্পূর্ন ভিন্ন। এটা খুব খারাপ, আপনাদের প্যান ক্রিম স্যুপের পরিমাণ খুব কম ছিল। মুরগির স্বাদ খারাপ ছিল এবং ঠান্ডা সার্ভ করা হয়েছিল।  এটাই কেবল আমারই নয়  এ ধরনের বিল নিয়ে সমস্যার মুখোমুখি BBQ বাংলাদেশ ধনমন্ডিতে আরো অনেক লোক হয়েছে । তারা সবাইকে হতাশ করেছে।"
0,আজ আমি পার্সেলের চারটা চিংড়ি ভাজা নিয়েছিলাম। আমি আমার ঘরে পৌঁছালাম এবং কিছুক্ষন পর খাওয়া শুরু করলাম এবং দেখলাম যে এটি থেকে খুবই খারাপ গন্ধ আসছে এবং খেতে পারলাম না ....... কখনও কখনও তাদের খাবার খুবই খারাপ হয়
0,আমি সরি কিন্তু  এখানে আমার খাওয়ার সবচেয়ে খারাপ অভিজ্ঞতা। অবশ্যই আমি আর সেখানে যাবনা।
0,চিকেন পিজা অর্ডার করেছিলাম কিন্তু এটাতে বিন্দুমাত্র ও টেস্ট নাই। এটা খেতে একটা প্যানকেকের মত লাগছিল। ভয়ানক সার্ভিস। আর যাবোনা সেখানে।
0,খাবার স্বাদ এত ভাল ছিলনা। Gangjeong চিকেনের ভিতর কোন মসলা ছিল না। ভেগ ফ্রাইড রাইসটা স্বাদে এবং পরিমাণে এভারেজের ও নিচে ছিল ।যদিও এটি একটি খারাপ অভিজ্ঞতা ছিল তারপর ও সেবা এবং জায়গাটা চমৎকার ছিল। স্বাদের তুলনায় খাবারের দাম খুব বেশী।
0,আই উইশ যদি আমি ০ স্টার দিতে পারতাম ... কম্বো পিজাটা সবচেয়ে খারাপ এবং জঘন্য ছিল _ _
0,ভয়ানক খাবার .... জায়গাটাতে বেশ ভীড় আছে .... দামও খুব বেশি ... শুধু শুধু টাকা অপচয়।
0,আমার খাওয়া সবচেয়ে খারাপ খাবার ছিল ...... এবং এটা জ্যামাইকান চিকেন ..... ওহ ..... আমি জানি না কেন মানুষ এটা খাওয়ার জন্য এত পাগল যেটা খেতে শুধুই  স্বাভাবিক মুরগীর মতই লাগে ​​... আমি কোনও  স্বাদ পাইনি .... আর মাশরুপ স্যুপ এটা একটি  ইয়াআক .... ewwwuuu .... খেয়ে মনে হচ্ছে শুকনো টোস্টেড বার্গারের মধ্যে পুরো ক্রিম  ইয়াআআকক ....
0,একটি বাচ্চাদের খাবার সার্ভ করার জন্য 45 মিনিট নিয়েছে। তাদের সার্ভিস অনেক খারাপ।
0,ভোরের সময় এসেছিলাম এবং 5 জনের জন্য অর্ডার করেছিলাম এবং এই সেবাটি সবচেয়ে জঘন্য ছিল। বরফ ঠান্ডা খাবার সার্ভ করা হইছিল  এবং অন্তত 30 মিনিটের জন্য অপেক্ষা করতে হয়েছিল। রাবিশ। এবং ম্যানেজারদের এই বিষয়ে কোনো মাথা ব্যাথা ছিলনা। এই জায়গায় কখনো যাবেননা!
0,"অন্যান্য রেস্টুরেন্টের তুলনায়, তারা জঘন্য সার্ভিস দেয় এবং খাবারের মানের নিয়ে কোন কথা না বলায় ঠিক হবে কারণ এটি  পুরো টাকাটাই অপচয় ছিল......"
0,"সার্ভিসটা ভয়ানক, আপনি যদি মূল্য অনুযায়ী খাবারের মান বিবেচনা করেন তবে এটি খুবই খারাপ খাবার। আমার পরামর্শ থাকবে আপনার সময় এবং অর্থ নষ্ট করতে এখানে না আসাটাই ঠিক হবে।"
0,আমার অভিজ্ঞতায় সবচেয়ে খারাপ খাবার । স্যুপটি ছিলো উষ্ণ পানির মত  ... এবং সেটমেনুর  মুরগীর মাংসটা একদমই স্বাদহীন ছিলো
0,"শুধুমাত্র ফটো তোলার জন্য ভাল খাবারে জন্য না। তারা প্যাড থাই নুডলস বিক্রি করে এবং তাদের মেনুতে এটি মিশ্র চাউমিন হিসাবে লেখা ছিল। এটা গ্রহণযোগ্য নয়। মুহম্মদপুর শাখার বেশির ভাগই কোন ভ্যাট চার্জ করে নি, কিন্তু তারা ভ্যাট চার্জ করেছে। সার্ভিস খুবই ধীরগতির। মূল্য অনুযায়ী খাবারের স্বাদ  চিহ্নিত ভালনা। সবসময়ের জন্য রিকমেন্ডেট না। সেট মেনুর স্বাদ এতটাই খারাপ ছিল যে আমরা এটা শেষ করতে পারিনি। "
0,"অন্যান্য রেস্টুরেন্ট এবং দামের তুলনায় খাবারের পরিমাণ সত্যিই কম।খাবারের মানও ভালনা। এসি বন্ধ ছিল। খাবারের মান সম্পর্কে অভিযোগ করেছি, তারা কোনো ব্যাখ্যা বা দুঃখিত ও বললনা। রিকমেন্ডেড না!"
0,"সবচেয়ে বাজে অভিজ্ঞতা...এই জায়গাটি দেখতে তাদের ছবিরটার মত নয় .. খাবারের মান খুবই ভয়ানক...আমি  স্পাঘেটিকে অর্ডার দিয়েছিলাম এবং তারা লবণাক্ত একটি ডিশ দিয়েছিল এবং এটা একদম বিশ্রী স্বাদ ছিল ... আমি সেই খারাপ খাবার খেয়ে পরে ভমি করে দিয়েছিলাম .. এবং গন্ধ খুব খারাপ ছিল। এক শব্দে এটা সবচেয়ে খারাপ ছিল। মুরগি ফ্রাই অর্ডার করার পরে আমি দেখলাম যে এটি লবণাক্ত  এবং খাওয়ার অযোগ্য ছিল। এবং তাদের সেবা এত খারাপ ছিল। আমি থালা পরিবর্তন করার জন্য তাদের একজনকে জিজ্ঞেস করলাম, কিন্তু তারা বলল যে পারবেনা। এই জায়গাটা একদমই রিকমেন্ডড না।  "
0,এক কথায় ফালতু ফালতু ফালতু........................
0,এটা সবচেয়ে খারাপ .. দাম খুব বেশী কিন্তু পরিমাণ খুব কম ... এবং স্বাদট কম লবণাক্ত হয় ...
0,"খাবারের গুণগত মান এভারেজ ,প্রাইসও এভারেজ। ব্যবস্থাপনা এবং পলিসি দুইটাই  বিশ্রী ছিল, পরিবেশটা খুব বেশি উষ্ণ ছিল , বাইরের কোনো এসি বা ফ্যান নেই।"
0,খারাপ আচরণ। সবচেয়ে জঘন্য ম্যানেজমেন্ট সিস্টেম। সবচেয়ে খারাপ অভিজ্ঞতা।
0,"নোংরা টয়লেট, লেট সার্ভিস। তাছাড়া কাস্টমার কেয়ারের কর্মীরা ফালতু ছিল।"
0,এত ফালতু খাবার আমি আর আমার ফেন্ডরা জিবনেও খাইনাই। পুরো টাকাটাই গেছে
0,কিছুই ভাল ছিল না।
0,টাকা অপচয় ...
0,উত্তরা শাখায় তারা খুব কম পরিমাণে খাবার পরিবেশন করে। তারা তাদের বিজ্ঞাপনে দেয়া ছবির তুলনায় পাচ গুন কম খাবার পরিবেশন করে।
0,তাদের চিকেন আইটেম অনেক টেস্টি কিন্তু আমাকে ইনবক্স করার পর ওইদিন আমরা ১৩ জন মিলে গিয়েছিলাম। যাওয়ার পর তারা বলল অফারটির নাকি দুইদিন আগেই মেয়াদ শেষ। খুবই জঘন্য ছিল। ওরা নিজেরাই জানেনা ওদের অফারের টাইম নিয়ে। অন্যথায় সবকিছুই ঠিক ছিল।
0,অত্যন্ত বাজে সার্ভিস এবং স্যুপটা খুব বেশি মাখনের মতো ছিল। ফালতু
0,আমি গত 2 ভিজিটে লক্ষ্য করেছি যে তাদের খাদ্যের মান খারাপ হয়েছে।
0,মূল্যের পরিপ্রেক্ষিতে খাদ্যের পরিমাণ খুবই কম ছিল। খাবারে মান এভারেজ ছিল। তাদের ওয়াইফাই আছে কিন্তু আমাদের পাসওয়ার্ড দিচ্ছে না। (ধনমন্ডি শাখার জন্য)
0,"আমরা চারটি ভিন্ন পিজা অর্ডার করেছিলাম। সবই প্রায় একই রকম। কোন লবণ, কোন মসলা, পাতলা আবরণ। শেফকে পিজা তৈরি করতে শিখাতে হবে। এই কিউই চিলারের মধ্যে শুধু সিরাপ এবং sprite ছিল। একটা টুকরাও  ছিল না কিউই । চিহ্ন পর্যন্ত ছিল না। সামগ্রিকভাবে sucks.not আবার আসছে না।"
0,"গতকাল গুলশান শাখায় গিয়েছিলাম। আমি সাধারণত তাদের খাবার পছন্দ করি কিন্তু গতকালের সার্ভিসটা বাজে ছিল! 3,000! টাকার উপরে বিল আসার পরও আমি SCB ক্রেডিট কার্ডে 10% ডিসকাউন্ট পাইনি।  প্রচারক কুপন প্রদানের জন্য তাদেরকে কয়েকবার সময় জিজ্ঞাসা করছিলাম। খুব হতাশ!"
0,কোন নিয়ম নাই ... খাবার ও সুস্বাদু না খুবই ফালতু।
0,আমি পাস্তা নিয়েছিলাম এবং আমি মনে করি চিংড়িতে কিছু একটা সমস্যা ছিল। আমার পরে ফুড পয়জন হয়েছিল এবং অসুস্থ হয়ে গেছিলাম। আমি রুটিতে মাখন দেয়ার জন্য কয়েকবার জিজ্ঞাসা করি কিন্তু তারা এটি করেনি। খেলার জায়গা এবং বেলুনগুলোও সুন্দর ছিল।
0,শেষবার যখন  খেয়েছিলাম তখন খাবার খুব খারাপ ছিল। আমি BBQ এর একজন নিয়মিত গ্রাহক ছিলাম কিন্তু ধীরে ধীরে তাদের খাবারের মান আস্তে আস্তে কমে যাচ্ছে ... আমি হতাশ হয়ে গিয়েছি ...
0,এটা  একটা পিজার অফার ছিল।  পিজা ভয়ানক ছিল । আমার খাওয়া সবচেয়ে খারাপ পিজা।
